id,name,slug,provider,tags,layerCount,layerNames,createdAt,dataLastUpdated,updatedAt,license,type,url,description
848d61af726f40d890219042253bedd7,PowerPlants_WorldResourcesInstitute,,JenniferBell_UO," plenary, power plants, hydro, solar, wind, gas, coal, oil, biomass, waste, nuclear, World Resources Institute, capacity, generation, ownership, fuel type, fuel, gigawatts, power",,,2018-07-02T22:05:06Z,2023-08-10T19:21:55Z,2023-08-10T19:21:55Z,custom,Feature Service,,"This layer contains over 28,000 power plant locations in 164 countries around the globe. Click on each power plant to view its:NameFuel type: hydro, solar, wind, gas, coal, oil, biomass, waste, nuclear, cogeneration, geothermal, petcoke, storage, wave and tidal, or otherCapacity (MW)Annual generation (GWh)Data sourceLink to more informationTo view additional information such as the data source year, geolocation source, latitude, and longitude, click on the table icon underneath the layer name. This feature layer employs Clustering which groups point features within a certain distance of one another into one symbol. When you zoom in, the clusters start to break up and greater point details are displayed. To view the popup for individual power plants, click on the cluster and select Browse Features. The Firefly symbology used for this layer works best with darker basemaps like the Firefly basemap, Nova basemap, or the Human Geography Dark basemap, all found in the Living Atlas of the World. This layer was created by the World Resources Institute and was last updated June 2018. The dataset is updated by the World Resources Institute every 4 to 6 months. For more information, please contact Aaron Kressig at aaron.kressig@wri.org."
282127096f344ed39a8d895d498d94c4,OSM_Landuse_NA,,smoore_osm,"osm, landuse, residential, farmland, forest, orchard, OpenStreetMap, North America",,,2020-01-03T00:15:56Z,2021-04-21T15:40:56Z,2021-04-21T15:40:56Z,ODbL-1.0,Feature Service,,"This feature layer provides access to OpenStreetMap (OSM) landuse areas data for North America, which is updated every 15 minutes with the latest edits. This hosted feature layer view is referencing a hosted feature layer of OSM polygon (closed way) data in ArcGIS Online that is updated with minutely diffs from the OSM planet file.  This feature layer view includes landuse features defined as a query against the hosted feature layer (i.e. landuse is not blank).In OSM, landuse describes the primary use of land by humans.  These features are identified with a landuse tag.  There are thousands of different tag values for landuse used in the OSM database.  In this feature layer, unique symbols are used for several of the most popular landuse types, while lesser used types are grouped in an ""other"" category.Zoom in to large scales (e.g. City level or 1:80k scale) to see the landuse area features display.  You can click on a feature to get the name of the landuse area (if available).  The name of the landuse area will display by default at large scales (e.g. Street level of 1:5k scale).  Labels can be turned off in your map if you prefer.Create New LayerIf you would like to create a more focused version of this landuse areas layer displaying just one or two landuse types, you can do that easily!  Just add the layer to a map, copy the layer in the content window, add a filter to the new layer (e.g. landuse is commercial), rename the layer as appropriate, and save layer.  You can also change the layer symbols or popup if you like.  Esri may publish a few such layers (e.g. residential, forest) that are ready to use, but not for every type of landuse area.Important Note: if you do create a new layer, it should be provided under the same Terms of Use and include the same Credits as this layer.  You can copy and paste the Terms of Use and Credits info below in the new Item page as needed."
8573b205d20d4be38b6e11eb05dd151b,OSM_Buildings_NA,,smoore_osm,"osm, building, OpenStreetMap, open data, beta, North America, United States, Canada, Mexico",,,2019-12-20T23:21:13Z,2021-04-14T18:05:22Z,2021-04-14T18:05:22Z,ODbL-1.0,Feature Service,,"This feature layer provides access to OpenStreetMap (OSM) buildings data for North America, which is updated every 1 minute with the latest edits. This hosted feature layer view is referencing a hosted feature layer of OSM polygon (closed way) data in ArcGIS Online that is updated with minutely diffs from the OSM planet file.  This feature layer view includes building features defined as a query against the hosted feature layer (i.e. building is not blank).In OSM, a building is a man-made structure with a roof, standing more or less permanently in one place.  These features are identified with a building tag.  There are thousands of different tag values for building used in the OSM database.  In this feature layer, unique symbols are used for several of the most popular building types, while lesser used types are grouped in an ""other"" category.Zoom in to large scales (e.g. Streets level or 1:10k scale) to see the building features display.  You can click on a feature to get the name of the building (if available).  The name of the building will display by default at large scales (e.g. Street level of 1:5k scale).  Labels can be turned off in your map if you prefer.Create New LayerIf you would like to create a more focused version of this buildings layer displaying just one or two building types, you can do that easily!  Just add the layer to a map, copy the layer in the content window, add a filter to the new layer (e.g. building is apartments), rename the layer as appropriate, and save layer.  You can also change the layer symbols or popup if you like.  Esri may publish a few such layers (e.g. parks) that are ready to use, but not for every type of building.Important Note: if you do create a new layer, it should be provided under the same Terms of Use and include the same Credits as this layer.  You can copy and paste the Terms of Use and Credits info below in the new Item page as needed."
49337b48580e4a83800aea4a8a181f80,OSM_Schools_Poly_NA,,smoore_osm,"osm, school, OpenStreetMap, college, kindergarten, university, North America, beta",,,2020-03-15T03:55:48Z,2020-11-03T18:06:21Z,2020-11-03T18:06:21Z,ODbL-1.0,Feature Service,,"This feature layer provides access to OpenStreetMap (OSM) educational establishment polygon data for North America, which is updated every 15 minutes with the latest edits. This hosted feature layer view is referencing a hosted feature layer of OSM polygon (way) data in ArcGIS Online that is updated with minutely diffs from the OSM planet file.  This feature layer view includes amenity features defined as a query against the hosted feature layer where the amenity value is any of 'school', 'university', 'college', or 'kindergarten'.In OSM, amenities are useful and important facilities for visitors and residents, such as schools and universities.  These features are identified with an amenity tag.  In OSM, amenity=school is used to identify a place where pupils, normally between the ages of about 6 and 18 are taught under the supervision of teachers. This includes primary and secondary schools. See amenity=college, amenity=university, and amenity=kindergarten for other educational establishments.Zoom in to large scales (e.g. Cities level or 1:160k scale) to see the educational features display.  You can click on a feature to get the name and any other available attributes of the feature.  The name of the feature will display by default at very large scales (e.g. Building level of 1:2k scale).  Labels can be turned off in your map if you prefer."
3e55b3ba0a604240aa0e2dc1081822e0,OSM_Addresses_NA,,smoore_osm,"osm, address, point, amenity, shop, North America, United States, Canada, Mexico",,,2020-01-21T23:50:42Z,2020-11-02T15:06:28Z,2020-11-02T15:06:28Z,ODbL-1.0,Feature Service,,"This feature layer provides access to OpenStreetMap (OSM) address point data for North America, which is updated every 1 minute with the latest edits. This hosted feature layer view is referencing a hosted feature layer of OSM point (node) data in ArcGIS Online that is updated with minutely diffs from the OSM planet file.  This feature layer view includes amenities, shops and other point features that have detailed address data, defined as a query against the hosted feature layer (i.e. addr:housenumber and addr:street is not blank).Zoom in to large scales (e.g. Neighborhood level or 1:20k scale) to see the address features display.  You can click on a feature to get the name of the feature (if available).  The name of the feature will display by default at large scales (e.g. Street level of 1:5k scale).  Labels can be turned off in your map if you prefer."
a20aca86493c4f8295ecf30aa0f2dea5,OSM_Leisure_NA,,smoore_osm,"osm, leisure, park, pitch, garden, pool, stadium, OpenStreetMap, North America, beta",,,2019-12-30T18:56:48Z,2020-05-17T22:59:25Z,2020-05-17T22:59:25Z,ODbL-1.0,Feature Service,,"This feature layer provides access to OpenStreetMap (OSM) leisure areas data for North America, which is updated every 15 minutes with the latest edits. This hosted feature layer view is referencing a hosted feature layer of OSM polygon (closed way) data in ArcGIS Online that is updated with minutely diffs from the OSM planet file.  This feature layer view includes leisure features defined as a query against the hosted feature layer (i.e. leisure is not blank).In OSM, a leisure area is a place where people go in their spare time.  These features are identified with a leisure tag.  There are thousands of different tag values for leisure used in the OSM database.  In this feature layer, unique symbols are used for several of the most popular leisure types, while lesser used types are grouped in an ""other"" category.Zoom in to large scales (e.g. City level or 1:80k scale) to see the leisure area features display.  You can click on a feature to get the name of the leisure area (if available).  The name of the leisure area will display by default at large scales (e.g. Street level of 1:5k scale).  Labels can be turned off in your map if you prefer.Create New LayerIf you would like to create a more focused version of this leisure areas layer displaying just one or two leisure types, you can do that easily!  Just add the layer to a map, copy the layer in the content window, add a filter to the new layer (e.g. leisure is stadium), rename the layer as appropriate, and save layer.  You can also change the layer symbols or popup if you like.  Esri may publish a few such layers (e.g. parks) that are ready to use, but not for every type of leisure area.Important Note: if you do create a new layer, it should be provided under the same Terms of Use and include the same Credits as this layer.  You can copy and paste the Terms of Use and Credits info below in the new Item page as needed."
103d643c221e40dea643bf7dff13364a,OSM_Medical_NA,,smoore_osm,"osm, medical, OpenStreetMap, North America, hospital, clinic, doctor, pharmacy",,,2020-03-14T19:16:21Z,2020-05-02T23:15:28Z,2020-05-02T23:15:28Z,ODbL-1.0,Feature Service,,"This feature layer provides access to OpenStreetMap (OSM) point data of medical facilities for North America, which is updated every 15 minutes with the latest edits. This hosted feature layer view is referencing a hosted feature layer of OSM point (node) data in ArcGIS Online that is updated with minutely diffs from the OSM planet file.  This feature layer view includes amenity features defined as a query against the hosted feature layer where the amenity value is any of 'hospital', 'clinic', 'doctors', or 'pharmacy'.In OSM, amenities are useful and important facilities for visitors and residents, such as hospitals and clinics.  These features are identified with an amenity tag.  There are thousands of different tag values used in the OSM database.  In this feature layer, unique symbols are used for the most common amenity tags used for medical facilities.Zoom in to large scales (e.g. Neighborhood level or 1:20k scale) to see the amenity features display.  You can click on a feature to get the name of the amenity.  The name of the amenity will display by default at very large scales (e.g. Building level of 1:2k scale).  Labels can be turned off in your map if you prefer.Create New LayerIf you would like to create a more focused version of this medical facilities layer displaying just one or two amenity types, you can do that easily!  Just add the layer to a map, copy the layer in the content window, add a filter to the new layer (e.g. amenity is hospital), rename the layer as appropriate, and save layer.  You can also change the layer symbols or popup if you like.  Esri will publish a few such layers (e.g. Places of Worship, Schools, and Parking) that are ready to use, but not for every type of amenity.Important Note: if you do create a new layer, it should be provided under the same Terms of Use and include the same Credits as this layer.  You can copy and paste the Terms of Use and Credits info below in the new Item page as needed."
bad87ec08d394721a032cd97a0f640a7,OSM_Amenities_NA,,smoore_osm,"osm, amenity, OpenStreetMap, open data, amenities, North America",,,2019-12-30T19:10:36Z,2020-04-30T21:58:02Z,2020-04-30T21:58:02Z,ODbL-1.0,Feature Service,,"This feature layer provides access to OpenStreetMap (OSM) amenity data for North America, which is updated every 5 minutes with the latest edits. This hosted feature layer view is referencing a hosted feature layer of OSM point (node) data in ArcGIS Online that is updated with minutely diffs from the OSM planet file.  This feature layer view includes amenity features defined as a query against the hosted feature layer (i.e. amenity is not blank).In OSM, amenities are useful and important facilities for visitors and residents, such as places of worship, restaurants, banks, and schools.  These features are identified with an amenity tag.  There are thousands of different tag values used in the OSM database.  In this feature layer, unique symbols are used for several of the most popular amenity types, while lesser used types are grouped in an ""other"" category.Zoom in to large scales (e.g. City level or 1:80k scale) to see the amenity features display.  You can click on a feature to get the name of the amenity.  The name of the amenity will display by default at very large scales (e.g. Building level of 1:2k scale).  Labels can be turned off in your map if you prefer.Create New LayerIf you would like to create a more focused version of this amenity layer displaying just one or two amenity types, you can do that easily!  Just add the layer to a map, copy the layer in the content window, add a filter to the new layer (e.g. amenity is fire station), rename the layer as appropriate, and save layer.  You can also change the layer symbols or popup if you like.  Esri will publish a few such layers (e.g. Schools, Medical Facilities, and Places of Worship) that are ready to use, but not for every type of amenity.Important Note: if you do create a new layer, it should be provided under the same Terms of Use and include the same Credits as this layer.  You can copy and paste the Terms of Use and Credits info below in the new Item page as needed."
97ceed5cfc984b4399e23888f6252856,OSM_Tourism_NA,,smoore_osm,"osm, tourism, tourist, attraction, information, OpenStreetMap, North America",,,2020-01-13T21:49:29Z,2020-04-21T20:55:05Z,2020-04-21T20:55:05Z,ODbL-1.0,Feature Service,,"This feature layer provides access to OpenStreetMap (OSM) tourist attraction point data for North America, which is updated every 5 minutes with the latest edits. This hosted feature layer view is referencing a hosted feature layer of OSM point (node) data in ArcGIS Online that is updated with minutely diffs from the OSM planet file.  This feature layer view includes tourism features defined as a query against the hosted feature layer (i.e. tourism is not blank).In OSM, tourism features are places and things of specific interest to tourists including places to see, places to stay, things and places providing information and support to tourists.  These features are identified with an tourism tag.  There are hundreds of different tag values used in the OSM database.  In this feature layer, unique symbols are used for several of the most popular tourism types, while lesser used types are grouped in an ""other"" category.Zoom in to large scales (e.g. Cities level or 1:160k scale) to see the tourism features display.  You can click on a feature to get the name of the tourism feature.  The name of the feature will display by default at very large scales (e.g. Building level of 1:2k scale).  Labels can be turned off in your map if you prefer.Create New LayerIf you would like to create a more focused version of this tourism layer displaying just one or two tourism types, you can do that easily!  Just add the layer to a map, copy the layer in the content window, add a filter to the new layer (e.g. tourism is ruin), rename the layer as appropriate, and save layer.  You can also change the layer symbols or popup if you like.Important Note: if you do create a new layer, it should be provided under the same Terms of Use and include the same Credits as this layer.  You can copy and paste the Terms of Use and Credits info below in the new Item page as needed."
a917a3c9e89544d9a1446251bb693bbd,OSM_Shops_NA,,smoore_osm,"osm, shop, store, service, OpenStreetMap, North America",,,2020-01-02T23:30:30Z,2020-04-21T20:32:51Z,2020-04-21T20:32:51Z,ODbL-1.0,Feature Service,,"This feature layer provides access to OpenStreetMap (OSM) shops data for North America, which is updated every 5 minutes with the latest edits. This hosted feature layer view is referencing a hosted feature layer of OSM point (node) data in ArcGIS Online that is updated with minutely diffs from the OSM planet file.  This feature layer view includes shop features defined as a query against the hosted feature layer (i.e. shop is not blank).In OSM, a shop is a place selling retail products or services, such as a supermarket, bakery, or florist.  These features are identified with a shop tag.  There are thousands of different tag values for shop used in the OSM database.  In this feature layer, unique symbols are used for several of the most popular shop types, while lesser used types are grouped in an ""other"" category.Zoom in to large scales (e.g. Neighborhood level or 1:80k scale) to see the shop features display.  You can click on a feature to get the name of the shop.  The name of the shop will display by default at very large scales (e.g. Building level of 1:2k scale).  Labels can be turned off in your map if you prefer.Create New LayerIf you would like to create a more focused version of this shop layer displaying just one or two shop types, you can do that easily!  Just add the layer to a map, copy the layer in the content window, add a filter to the new layer (e.g. shop is jewelry), rename the layer as appropriate, and save layer.  You can also change the layer symbols or popup if you like.  Esri may publish a few such layers (e.g. supermarket or convenience shop) that are ready to use, but not for every type of shop.Important Note: if you do create a new layer, it should be provided under the same Terms of Use and include the same Credits as this layer.  You can copy and paste the Terms of Use and Credits info below in the new Item page as needed."
